id	description_en	codesystem	code	data_type	description_code	codelist_ref	input_type	properties	parent	comments
Percentage Q30	Percentage of reads with a Phred quality score over 30, which indicates less than a 1/1000 chance that the base was called incorrectly.	GENEPIO	0000089	DECIMAL	Percentage Q30		text	{url=http://purl.obolibrary.org/obo/GENEPIO_0000089}	Sequencing	
Percentage TR20	Percentage of the target sequence on which 20 or more unique reads were successfully mapped.	FG	PercentageTR20	DECIMAL	Percentage TR20		text	{url=https://fair-genomes.org/PercentageTR20}	Sequencing	
Other quality metrics	Other NGS quality control metrics, including but not limited to (i) sequencer metrics such as yield, error rate, density (K/mm2), cluster PF (%) and phas/prephas (%), (ii) alignment metrics such as QM insert size, GC content, QM duplicated reads (%), QM error rate, uniformity/evenness of coverage and maternal cell contamination, and (iii) variant call metrics such as number of SNVs/CNVs/SVs called, number of missense/nonsense variants, common variants (%), unique variants (%), gender match and trio inheritance check.	EDAM	data_3914	ST	Other quality metrics		text	{url=http://edamontology.org/data_3914}	Sequencing	
Analysis	Apply analytical methods to existing data of a specific type.	EDAM	operation_2945	ST	Analysis		multi-select	{url=http://edamontology.org/operation_2945}		
Analysis identifier	An assay identifier is an identifier that identifies some assay (analysis).	AFR	0001979	ST	Analysis identifier		text	{url=http://purl.allotrope.org/ontologies/result#AFR_0001979}	Analysis	
Belongs to sequencing	Link to the sequencing performed i.e. source on which the analysis is based.	NCIT	C25683	ST	Belongs to sequencing		text	{url=http://purl.obolibrary.org/obo/NCIT_C25683}	Analysis	
Physical data location	A reference to a place on the Earth, by its name or by its geographical location. This definition is intentionally vague to allow reuse locally (e.g. which computer), for contacting (e.g. which institute), broadly for logistical or legal reasons (e.g. city, country or continent).	GAZ	00000448	ST	Physical data location		text	{url=http://purl.obolibrary.org/obo/GAZ_00000448}	Analysis	
Abstract data location	To maintain data by placing the data, or a copy of the data, onto an electronically accessible device for preservation (either in plain-text or encrypted format).	NCIT	C142494	ST	Abstract data location		text	{url=http://purl.obolibrary.org/obo/NCIT_C142494}	Analysis	
Data formats stored	A defined way or layout of representing and structuring data in a computer file, blob, string, message, or elsewhere.	EDAM	format_1915	ST	Data formats stored	DataFormats	multi-select	{url=http://edamontology.org/format_1915}	Analysis	
Algorithms used	A defined procedure for solving a problem. Applied to a problem-solving procedure implemented in software to be executed by a computer.	NCIT	C16275	ST	Algorithms used		text	{url=http://purl.obolibrary.org/obo/NCIT_C16275}	Analysis	
Bioinformatic protocol used	A human-readable collection of information about about how a scientific experiment or analysis was carried out that results in a specific set of data or results used for further analysis or to test a specific hypothesis.	EDAM	data_2531	ST	Bioinformatic protocol used		text	{url=http://edamontology.org/data_2531}	Analysis	
Bioinformatic protocol deviation	A variation from processes or procedures defined in the bioinformatic protocol. Deviations usually do not preclude the overall evaluability of subject data for either efficacy or safety, and are often acknowledged and accepted in advance by the sponsor.	NCIT	C50996	ST	Bioinformatic protocol deviation		text	{url=http://purl.obolibrary.org/obo/NCIT_C50996}	Analysis	
Reason for bioinformatic protocol deviation	The rationale for why a deviation from the bioinformatic protocol has occurred.	NCIT	C93529	ST	Reason for bioinformatic protocol deviation		text	{url=http://purl.obolibrary.org/obo/NCIT_C93529}	Analysis	
WGS guideline followed	Any followed systematic statement of policy rules or principles. Guidelines may be developed by government agencies at any level, institutions, professional societies, governing boards, or by convening expert panels.	NCIT	C17564	ST	WGS guideline followed		text	{url=http://purl.obolibrary.org/obo/NCIT_C17564}	Analysis	
