value_en	description_en	codesystem	code	description_code
NEXTFLEX Unique Dual Index Barcodes by PerkinElmer	NEXTFLEX Unique Dual Index Barcodes by PerkinElmer sourced from https://www.biocompare.com, accessed May 2020.	FG	https://fair-genomes.org/KIT1	NEXTFLEX Unique Dual Index Barcodes by PerkinElmer
SEQuoia Complete Stranded RNA Library Prep Kit by Bio-Rad	SEQuoia Complete Stranded RNA Library Prep Kit by Bio-Rad sourced from https://www.biocompare.com, accessed May 2020.	FG	https://fair-genomes.org/KIT2	SEQuoia Complete Stranded RNA Library Prep Kit by Bio-Rad
KAPA HyperPlus Kits by Roche	KAPA HyperPlus Kits by Roche sourced from https://www.biocompare.com, accessed May 2020.	FG	https://fair-genomes.org/KIT3	KAPA HyperPlus Kits by Roche
Twist Human Core Exome Kit by Twist Bioscience	Twist Human Core Exome Kit by Twist Bioscience sourced from https://www.biocompare.com, accessed May 2020.	FG	https://fair-genomes.org/KIT4	Twist Human Core Exome Kit by Twist Bioscience
Driver-Map Human Genome-Wide Targeted Expression Profiling Kit (24 reactions) by Cellecta	Driver-Map Human Genome-Wide Targeted Expression Profiling Kit (24 reactions) by Cellecta sourced from https://www.biocompare.com, accessed May 2020.	FG	https://fair-genomes.org/KIT5	Driver-Map Human Genome-Wide Targeted Expression Profiling Kit (24 reactions) by Cellecta
ChIP-seq Kit For Histones (High Sensitivity) by BosterBio	ChIP-seq Kit For Histones (High Sensitivity) by BosterBio sourced from https://www.biocompare.com, accessed May 2020.	FG	https://fair-genomes.org/KIT6	ChIP-seq Kit For Histones (High Sensitivity) by BosterBio
ChIP-seq Kit For Transcription Factors (High Sensitivity) by BosterBio	ChIP-seq Kit For Transcription Factors (High Sensitivity) by BosterBio sourced from https://www.biocompare.com, accessed May 2020.	FG	https://fair-genomes.org/KIT7	ChIP-seq Kit For Transcription Factors (High Sensitivity) by BosterBio
HyperCap Workflow by Roche	HyperCap Workflow by Roche sourced from https://www.biocompare.com, accessed May 2020.	FG	https://fair-genomes.org/KIT8	HyperCap Workflow by Roche
SeqCap RNA System by Roche	SeqCap RNA System by Roche sourced from https://www.biocompare.com, accessed May 2020.	FG	https://fair-genomes.org/KIT9	SeqCap RNA System by Roche
MagicPureTM Size Selection DNA Beads by TransGen Biotech Co., LTD	MagicPureTM Size Selection DNA Beads by TransGen Biotech Co., LTD sourced from https://www.biocompare.com, accessed May 2020.	FG	https://fair-genomes.org/KIT10	MagicPureTM Size Selection DNA Beads by TransGen Biotech Co., LTD
NEXTFLEX UDI Barcodes (1-1,536) by PerkinElmer	NEXTFLEX UDI Barcodes (1-1,536) by PerkinElmer sourced from https://www.biocompare.com, accessed May 2020.	FG	https://fair-genomes.org/KIT11	NEXTFLEX UDI Barcodes (1-1,536) by PerkinElmer
NEXTflex Small RNA Sequencing Kit v3 for Illumina Platforms by PerkinElmer	NEXTflex Small RNA Sequencing Kit v3 for Illumina Platforms by PerkinElmer sourced from https://www.biocompare.com, accessed May 2020.	FG	https://fair-genomes.org/KIT12	NEXTflex Small RNA Sequencing Kit v3 for Illumina Platforms by PerkinElmer
Blunt/TA Ligase Master Mix by New England Biolabs	Blunt/TA Ligase Master Mix by New England Biolabs sourced from https://www.biocompare.com, accessed May 2020.	FG	https://fair-genomes.org/KIT13	Blunt/TA Ligase Master Mix by New England Biolabs
NEBNext ChIP-Seq Library Prep Master Mix Set for Illumina by New England Biolabs	NEBNext ChIP-Seq Library Prep Master Mix Set for Illumina by New England Biolabs sourced from https://www.biocompare.com, accessed May 2020.	FG	https://fair-genomes.org/KIT14	NEBNext ChIP-Seq Library Prep Master Mix Set for Illumina by New England Biolabs
Auto ChIPmentation for Histones by Diagenode	Auto ChIPmentation for Histones by Diagenode sourced from https://www.biocompare.com, accessed May 2020.	FG	https://fair-genomes.org/KIT15	Auto ChIPmentation for Histones by Diagenode
Auto MagMeDIP 10 rxn by Diagenode	Auto MagMeDIP 10 rxn by Diagenode sourced from https://www.biocompare.com, accessed May 2020.	FG	https://fair-genomes.org/KIT16	Auto MagMeDIP 10 rxn by Diagenode
InviGene Bisulfite Conversion Kit - 50 conversions by AS ONE INTERNATIONAL	InviGene Bisulfite Conversion Kit - 50 conversions by AS ONE INTERNATIONAL sourced from https://www.biocompare.com, accessed May 2020.	FG	https://fair-genomes.org/KIT17	InviGene Bisulfite Conversion Kit - 50 conversions by AS ONE INTERNATIONAL
InviMag Bisulfite Conversion Kit/ IG - 4 x 12 conversions by AS ONE INTERNATIONAL	InviMag Bisulfite Conversion Kit/ IG - 4 x 12 conversions by AS ONE INTERNATIONAL sourced from https://www.biocompare.com, accessed May 2020.	FG	https://fair-genomes.org/KIT18	InviMag Bisulfite Conversion Kit/ IG - 4 x 12 conversions by AS ONE INTERNATIONAL
EpiNext Bisulfite Sequencing Kit (Illumina) by EpiGentek	EpiNext Bisulfite Sequencing Kit (Illumina) by EpiGentek sourced from https://www.biocompare.com, accessed May 2020.	FG	https://fair-genomes.org/KIT19	EpiNext Bisulfite Sequencing Kit (Illumina) by EpiGentek
EpiNext ChIP-Seq High-Sensitivity Kit (Illumina) by EpiGentek	EpiNext ChIP-Seq High-Sensitivity Kit (Illumina) by EpiGentek sourced from https://www.biocompare.com, accessed May 2020.	FG	https://fair-genomes.org/KIT20	EpiNext ChIP-Seq High-Sensitivity Kit (Illumina) by EpiGentek
Seq-Star DNA Size Selection Kit by Arraystar, Inc	Seq-Star DNA Size Selection Kit by Arraystar, Inc sourced from https://www.biocompare.com, accessed May 2020.	FG	https://fair-genomes.org/KIT21	Seq-Star DNA Size Selection Kit by Arraystar, Inc
Seq-Star poly(A) mRNA Isolation Kit by Arraystar, Inc	Seq-Star poly(A) mRNA Isolation Kit by Arraystar, Inc sourced from https://www.biocompare.com, accessed May 2020.	FG	https://fair-genomes.org/KIT22	Seq-Star poly(A) mRNA Isolation Kit by Arraystar, Inc
Auto MagMeDIP 48 rxn by Diagenode	Auto MagMeDIP 48 rxn by Diagenode sourced from https://www.biocompare.com, accessed May 2020.	FG	https://fair-genomes.org/KIT23	Auto MagMeDIP 48 rxn by Diagenode
Auto Universal Plant ChIP-seq kit by Diagenode	Auto Universal Plant ChIP-seq kit by Diagenode sourced from https://www.biocompare.com, accessed May 2020.	FG	https://fair-genomes.org/KIT24	Auto Universal Plant ChIP-seq kit by Diagenode
Auto iDeal ChIP-seq Kit for Transcription Factors by Diagenode	Auto iDeal ChIP-seq Kit for Transcription Factors by Diagenode sourced from https://www.biocompare.com, accessed May 2020.	FG	https://fair-genomes.org/KIT25	Auto iDeal ChIP-seq Kit for Transcription Factors by Diagenode
Auto iDeal ChIP-seq Kit for Transcription Factors x24 by Diagenode	Auto iDeal ChIP-seq Kit for Transcription Factors x24 by Diagenode sourced from https://www.biocompare.com, accessed May 2020.	FG	https://fair-genomes.org/KIT26	Auto iDeal ChIP-seq Kit for Transcription Factors x24 by Diagenode
Auto iDeal ChIP-seq kit for Histones x100 by Diagenode	Auto iDeal ChIP-seq kit for Histones x100 by Diagenode sourced from https://www.biocompare.com, accessed May 2020.	FG	https://fair-genomes.org/KIT27	Auto iDeal ChIP-seq kit for Histones x100 by Diagenode
Auto iDeal ChIP-seq kit for Histones x24 by Diagenode	Auto iDeal ChIP-seq kit for Histones x24 by Diagenode sourced from https://www.biocompare.com, accessed May 2020.	FG	https://fair-genomes.org/KIT28	Auto iDeal ChIP-seq kit for Histones x24 by Diagenode
CATS RNA-seq by Diagenode	CATS RNA-seq by Diagenode sourced from https://www.biocompare.com, accessed May 2020.	FG	https://fair-genomes.org/KIT29	CATS RNA-seq by Diagenode
CATS mRNA-seq (with polyA selection) by Diagenode	CATS mRNA-seq (with polyA selection) by Diagenode sourced from https://www.biocompare.com, accessed May 2020.	FG	https://fair-genomes.org/KIT30	CATS mRNA-seq (with polyA selection) by Diagenode
CATS small RNA-seq by Diagenode	CATS small RNA-seq by Diagenode sourced from https://www.biocompare.com, accessed May 2020.	FG	https://fair-genomes.org/KIT31	CATS small RNA-seq by Diagenode
CATS total RNA-seq (with rRNA depletion) by Diagenode	CATS total RNA-seq (with rRNA depletion) by Diagenode sourced from https://www.biocompare.com, accessed May 2020.	FG	https://fair-genomes.org/KIT32	CATS total RNA-seq (with rRNA depletion) by Diagenode
Universal Plant ChIP-seq kit by Diagenode	Universal Plant ChIP-seq kit by Diagenode sourced from https://www.biocompare.com, accessed May 2020.	FG	https://fair-genomes.org/KIT33	Universal Plant ChIP-seq kit by Diagenode
iDeal ChIP-seq Kit for Transcription Factors x100 by Diagenode	iDeal ChIP-seq Kit for Transcription Factors x100 by Diagenode sourced from https://www.biocompare.com, accessed May 2020.	FG	https://fair-genomes.org/KIT34	iDeal ChIP-seq Kit for Transcription Factors x100 by Diagenode
iDeal ChIP-seq kit for Histones x10 by Diagenode	iDeal ChIP-seq kit for Histones x10 by Diagenode sourced from https://www.biocompare.com, accessed May 2020.	FG	https://fair-genomes.org/KIT35	iDeal ChIP-seq kit for Histones x10 by Diagenode
iDeal ChIP-seq kit for Histones x100 by Diagenode	iDeal ChIP-seq kit for Histones x100 by Diagenode sourced from https://www.biocompare.com, accessed May 2020.	FG	https://fair-genomes.org/KIT36	iDeal ChIP-seq kit for Histones x100 by Diagenode
iDeal ChIP-seq kit for Histones x24 by Diagenode	iDeal ChIP-seq kit for Histones x24 by Diagenode sourced from https://www.biocompare.com, accessed May 2020.	FG	https://fair-genomes.org/KIT37	iDeal ChIP-seq kit for Histones x24 by Diagenode
iDeal ChIP-seq kit for Transcription Factors x10 by Diagenode	iDeal ChIP-seq kit for Transcription Factors x10 by Diagenode sourced from https://www.biocompare.com, accessed May 2020.	FG	https://fair-genomes.org/KIT38	iDeal ChIP-seq kit for Transcription Factors x10 by Diagenode
iDeal ChIP-seq kit for Transcription Factors x24 by Diagenode	iDeal ChIP-seq kit for Transcription Factors x24 by Diagenode sourced from https://www.biocompare.com, accessed May 2020.	FG	https://fair-genomes.org/KIT39	iDeal ChIP-seq kit for Transcription Factors x24 by Diagenode
KAPA Library Quantification Kit (Bio-Rad) by Roche	KAPA Library Quantification Kit (Bio-Rad) by Roche sourced from https://www.biocompare.com, accessed May 2020.	FG	https://fair-genomes.org/KIT40	KAPA Library Quantification Kit (Bio-Rad) by Roche
KAPA Library Quantification Kit (ROX Low) by Roche	KAPA Library Quantification Kit (ROX Low) by Roche sourced from https://www.biocompare.com, accessed May 2020.	FG	https://fair-genomes.org/KIT41	KAPA Library Quantification Kit (ROX Low) by Roche
KAPA Library Quantification Kit (Universal) by Roche	KAPA Library Quantification Kit (Universal) by Roche sourced from https://www.biocompare.com, accessed May 2020.	FG	https://fair-genomes.org/KIT42	KAPA Library Quantification Kit (Universal) by Roche
KAPA Library Quantification Kit (optimized for Roche LightCycler 480) by Roche	KAPA Library Quantification Kit (optimized for Roche LightCycler 480) by Roche sourced from https://www.biocompare.com, accessed May 2020.	FG	https://fair-genomes.org/KIT43	KAPA Library Quantification Kit (optimized for Roche LightCycler 480) by Roche
KAPA Library Quantification Kits by Roche	KAPA Library Quantification Kits by Roche sourced from https://www.biocompare.com, accessed May 2020.	FG	https://fair-genomes.org/KIT44	KAPA Library Quantification Kits by Roche
KAPA Low throughput Library Preparation KitIllumina, with bead by Roche	KAPA Low throughput Library Preparation KitIllumina, with bead by Roche sourced from https://www.biocompare.com, accessed May 2020.	FG	https://fair-genomes.org/KIT45	KAPA Low throughput Library Preparation KitIllumina, with bead by Roche
KAPA Low throughput Library Preparation KitIllumina, with bead, PCR-free by Roche	KAPA Low throughput Library Preparation KitIllumina, with bead, PCR-free by Roche sourced from https://www.biocompare.com, accessed May 2020.	FG	https://fair-genomes.org/KIT46	KAPA Low throughput Library Preparation KitIllumina, with bead, PCR-free by Roche
KAPA Low throughput Library Preparation KitIllumina, with real-time PCR library amplification by Roche	KAPA Low throughput Library Preparation KitIllumina, with real-time PCR library amplification by Roche sourced from https://www.biocompare.com, accessed May 2020.	FG	https://fair-genomes.org/KIT47	KAPA Low throughput Library Preparation KitIllumina, with real-time PCR library amplification by Roche
KAPA Low throughput Library Preparation KitIllumina, with real-time library amplification by Roche	KAPA Low throughput Library Preparation KitIllumina, with real-time library amplification by Roche sourced from https://www.biocompare.com, accessed May 2020.	FG	https://fair-genomes.org/KIT48	KAPA Low throughput Library Preparation KitIllumina, with real-time library amplification by Roche
KAPA Low throughput Library Preparation KitIon Torrent by Roche	KAPA Low throughput Library Preparation KitIon Torrent by Roche sourced from https://www.biocompare.com, accessed May 2020.	FG	https://fair-genomes.org/KIT49	KAPA Low throughput Library Preparation KitIon Torrent by Roche
KAPA Low throughput Library Preparation KitIon Torrent, PCR free by Roche	KAPA Low throughput Library Preparation KitIon Torrent, PCR free by Roche sourced from https://www.biocompare.com, accessed May 2020.	FG	https://fair-genomes.org/KIT50	KAPA Low throughput Library Preparation KitIon Torrent, PCR free by Roche
KAPA RNA HyperPrep Kits by Roche	KAPA RNA HyperPrep Kits by Roche sourced from https://www.biocompare.com, accessed May 2020.	FG	https://fair-genomes.org/KIT51	KAPA RNA HyperPrep Kits by Roche
KAPA Real-time PCR library amplification Kit, with fluorescent standards by Roche	KAPA Real-time PCR library amplification Kit, with fluorescent standards by Roche sourced from https://www.biocompare.com, accessed May 2020.	FG	https://fair-genomes.org/KIT52	KAPA Real-time PCR library amplification Kit, with fluorescent standards by Roche
KAPA Stranded RNA-Seq KitIllumina by Roche	KAPA Stranded RNA-Seq KitIllumina by Roche sourced from https://www.biocompare.com, accessed May 2020.	FG	https://fair-genomes.org/KIT53	KAPA Stranded RNA-Seq KitIllumina by Roche
KAPA Stranded RNA-Seq with RiboErase (HMR) 24 Reactions by Roche	KAPA Stranded RNA-Seq with RiboErase (HMR) 24 Reactions by Roche sourced from https://www.biocompare.com, accessed May 2020.	FG	https://fair-genomes.org/KIT54	KAPA Stranded RNA-Seq with RiboErase (HMR) 24 Reactions by Roche
KAPA Stranded RNA-Seq with RiboErase (HMR) 96 Reactions by Roche	KAPA Stranded RNA-Seq with RiboErase (HMR) 96 Reactions by Roche sourced from https://www.biocompare.com, accessed May 2020.	FG	https://fair-genomes.org/KIT55	KAPA Stranded RNA-Seq with RiboErase (HMR) 96 Reactions by Roche
KAPA Stranded mRNA-Seq KitIllumina, with KAPA mRNA Capture Beads by Roche	KAPA Stranded mRNA-Seq KitIllumina, with KAPA mRNA Capture Beads by Roche sourced from https://www.biocompare.com, accessed May 2020.	FG	https://fair-genomes.org/KIT56	KAPA Stranded mRNA-Seq KitIllumina, with KAPA mRNA Capture Beads by Roche
SeqCap Adapter Kit A by Roche	SeqCap Adapter Kit A by Roche sourced from https://www.biocompare.com, accessed May 2020.	FG	https://fair-genomes.org/KIT57	SeqCap Adapter Kit A by Roche
SeqCap Adapter Kit B by Roche	SeqCap Adapter Kit B by Roche sourced from https://www.biocompare.com, accessed May 2020.	FG	https://fair-genomes.org/KIT58	SeqCap Adapter Kit B by Roche
SeqCap Epi System by Roche	SeqCap Epi System by Roche sourced from https://www.biocompare.com, accessed May 2020.	FG	https://fair-genomes.org/KIT59	SeqCap Epi System by Roche
KAPA HyperPrep Kits by Roche	KAPA HyperPrep Kits by Roche sourced from https://www.biocompare.com, accessed May 2020.	FG	https://fair-genomes.org/KIT60	KAPA HyperPrep Kits by Roche
Adapter Kit, barcodes 1 - 8 by Roche	Adapter Kit, barcodes 1 - 8 by Roche sourced from https://www.biocompare.com, accessed May 2020.	FG	https://fair-genomes.org/KIT61	Adapter Kit, barcodes 1 - 8 by Roche
Adapter Kit, barcodes 17 - 24 by Roche	Adapter Kit, barcodes 17 - 24 by Roche sourced from https://www.biocompare.com, accessed May 2020.	FG	https://fair-genomes.org/KIT62	Adapter Kit, barcodes 17 - 24 by Roche
Adapter Kit, barcodes 9 - 16 by Roche	Adapter Kit, barcodes 9 - 16 by Roche sourced from https://www.biocompare.com, accessed May 2020.	FG	https://fair-genomes.org/KIT63	Adapter Kit, barcodes 9 - 16 by Roche
Adapter Kit, non-barcoded by Roche	Adapter Kit, non-barcoded by Roche sourced from https://www.biocompare.com, accessed May 2020.	FG	https://fair-genomes.org/KIT64	Adapter Kit, non-barcoded by Roche
KAPA High Throughput Library Preparation Kit by Roche	KAPA High Throughput Library Preparation Kit by Roche sourced from https://www.biocompare.com, accessed May 2020.	FG	https://fair-genomes.org/KIT65	KAPA High Throughput Library Preparation Kit by Roche
KAPA High throughput Library Preparation KitIllumina, with bead by Roche	KAPA High throughput Library Preparation KitIllumina, with bead by Roche sourced from https://www.biocompare.com, accessed May 2020.	FG	https://fair-genomes.org/KIT66	KAPA High throughput Library Preparation KitIllumina, with bead by Roche
KAPA High throughput Library Preparation KitIllumina, with bead, PCR-free by Roche	KAPA High throughput Library Preparation KitIllumina, with bead, PCR-free by Roche sourced from https://www.biocompare.com, accessed May 2020.	FG	https://fair-genomes.org/KIT67	KAPA High throughput Library Preparation KitIllumina, with bead, PCR-free by Roche
KAPA Hyper Prep KitIllumina, with KAPA Library Amplification Primer Mix (10X) by Roche	KAPA Hyper Prep KitIllumina, with KAPA Library Amplification Primer Mix (10X) by Roche sourced from https://www.biocompare.com, accessed May 2020.	FG	https://fair-genomes.org/KIT68	KAPA Hyper Prep KitIllumina, with KAPA Library Amplification Primer Mix (10X) by Roche
KAPA Hyper Prep KitIllumina, without amplification module by Roche	KAPA Hyper Prep KitIllumina, without amplification module by Roche sourced from https://www.biocompare.com, accessed May 2020.	FG	https://fair-genomes.org/KIT69	KAPA Hyper Prep KitIllumina, without amplification module by Roche
KAPA HyperPlus Kit, PCR-Free by Roche	KAPA HyperPlus Kit, PCR-Free by Roche sourced from https://www.biocompare.com, accessed May 2020.	FG	https://fair-genomes.org/KIT70	KAPA HyperPlus Kit, PCR-Free by Roche
KAPA HyperPlus Kit, with Library Amplification by Roche	KAPA HyperPlus Kit, with Library Amplification by Roche sourced from https://www.biocompare.com, accessed May 2020.	FG	https://fair-genomes.org/KIT71	KAPA HyperPlus Kit, with Library Amplification by Roche
KAPA Library Amplification Kit with primer mix by Roche	KAPA Library Amplification Kit with primer mix by Roche sourced from https://www.biocompare.com, accessed May 2020.	FG	https://fair-genomes.org/KIT72	KAPA Library Amplification Kit with primer mix by Roche
KAPA Library Amplification Kit - Standard kit by Roche	KAPA Library Amplification Kit - Standard kit by Roche sourced from https://www.biocompare.com, accessed May 2020.	FG	https://fair-genomes.org/KIT73	KAPA Library Amplification Kit - Standard kit by Roche
KAPA Library Preparation Kits by Roche	KAPA Library Preparation Kits by Roche sourced from https://www.biocompare.com, accessed May 2020.	FG	https://fair-genomes.org/KIT74	KAPA Library Preparation Kits by Roche
KAPA Library Quantification Kit (ABI Prism) by Roche	KAPA Library Quantification Kit (ABI Prism) by Roche sourced from https://www.biocompare.com, accessed May 2020.	FG	https://fair-genomes.org/KIT75	KAPA Library Quantification Kit (ABI Prism) by Roche
ClaSeek Library Preparation Kit, Illumina compatible by Thermo Fisher Scientific	ClaSeek Library Preparation Kit, Illumina compatible by Thermo Fisher Scientific sourced from https://www.biocompare.com, accessed May 2020.	FG	https://fair-genomes.org/KIT76	ClaSeek Library Preparation Kit, Illumina compatible by Thermo Fisher Scientific
Bisulfite-Seq High Sensitivity Kit (For Illumina) by Abcam	Bisulfite-Seq High Sensitivity Kit (For Illumina) by Abcam sourced from https://www.biocompare.com, accessed May 2020.	FG	https://fair-genomes.org/KIT77	Bisulfite-Seq High Sensitivity Kit (For Illumina) by Abcam
ChIP-Seq High Sensitivity Kit by Abcam	ChIP-Seq High Sensitivity Kit by Abcam sourced from https://www.biocompare.com, accessed May 2020.	FG	https://fair-genomes.org/KIT78	ChIP-Seq High Sensitivity Kit by Abcam
RhinoSeq DNA Library Preparation Kit by SeqOnce Biosciences	RhinoSeq DNA Library Preparation Kit by SeqOnce Biosciences sourced from https://www.biocompare.com, accessed May 2020.	FG	https://fair-genomes.org/KIT79	RhinoSeq DNA Library Preparation Kit by SeqOnce Biosciences
ClearSeq AML, HS, ILM, 16 by Agilent Technologies	ClearSeq AML, HS, ILM, 16 by Agilent Technologies sourced from https://www.biocompare.com, accessed May 2020.	FG	https://fair-genomes.org/KIT80	ClearSeq AML, HS, ILM, 16 by Agilent Technologies
ClearSeq AML, HS, ILM, 96 by Agilent Technologies	ClearSeq AML, HS, ILM, 96 by Agilent Technologies sourced from https://www.biocompare.com, accessed May 2020.	FG	https://fair-genomes.org/KIT81	ClearSeq AML, HS, ILM, 96 by Agilent Technologies
Wizard MagneSil Sequencing Reaction Clean-Up System by Promega	Wizard MagneSil Sequencing Reaction Clean-Up System by Promega sourced from https://www.biocompare.com, accessed May 2020.	FG	https://fair-genomes.org/KIT82	Wizard MagneSil Sequencing Reaction Clean-Up System by Promega
NucleoMag NGS Clean-up and Size Select by MACHEREY-NAGEL	NucleoMag NGS Clean-up and Size Select by MACHEREY-NAGEL sourced from https://www.biocompare.com, accessed May 2020.	FG	https://fair-genomes.org/KIT83	NucleoMag NGS Clean-up and Size Select by MACHEREY-NAGEL
NucleoSEQ by MACHEREY-NAGEL	NucleoSEQ by MACHEREY-NAGEL sourced from https://www.biocompare.com, accessed May 2020.	FG	https://fair-genomes.org/KIT84	NucleoSEQ by MACHEREY-NAGEL
SeqCap RNA Choice Enrichment Kit by Roche NimbleGen	SeqCap RNA Choice Enrichment Kit by Roche NimbleGen sourced from https://www.biocompare.com, accessed May 2020.	FG	https://fair-genomes.org/KIT85	SeqCap RNA Choice Enrichment Kit by Roche NimbleGen
SeqCap RNA Choice XL Enrichment Kit by Roche NimbleGen	SeqCap RNA Choice XL Enrichment Kit by Roche NimbleGen sourced from https://www.biocompare.com, accessed May 2020.	FG	https://fair-genomes.org/KIT86	SeqCap RNA Choice XL Enrichment Kit by Roche NimbleGen
Twist Fast Hybridization and Wash Kit by Twist Bioscience	Twist Fast Hybridization and Wash Kit by Twist Bioscience sourced from https://www.biocompare.com, accessed May 2020.	FG	https://fair-genomes.org/KIT87	Twist Fast Hybridization and Wash Kit by Twist Bioscience
GeneJET NGS Cleanup Kit by Thermo Fisher Scientific	GeneJET NGS Cleanup Kit by Thermo Fisher Scientific sourced from https://www.biocompare.com, accessed May 2020.	FG	https://fair-genomes.org/KIT88	GeneJET NGS Cleanup Kit by Thermo Fisher Scientific
GeneJET NGS Cleanup Kit (165 mL) by Thermo Fisher Scientific	GeneJET NGS Cleanup Kit (165 mL) by Thermo Fisher Scientific sourced from https://www.biocompare.com, accessed May 2020.	FG	https://fair-genomes.org/KIT89	GeneJET NGS Cleanup Kit (165 mL) by Thermo Fisher Scientific
GeneJET NGS Cleanup Kit (40 mL) by Thermo Fisher Scientific	GeneJET NGS Cleanup Kit (40 mL) by Thermo Fisher Scientific sourced from https://www.biocompare.com, accessed May 2020.	FG	https://fair-genomes.org/KIT90	GeneJET NGS Cleanup Kit (40 mL) by Thermo Fisher Scientific
GeneJET NGS Cleanup Kit (44 mL) by Thermo Fisher Scientific	GeneJET NGS Cleanup Kit (44 mL) by Thermo Fisher Scientific sourced from https://www.biocompare.com, accessed May 2020.	FG	https://fair-genomes.org/KIT91	GeneJET NGS Cleanup Kit (44 mL) by Thermo Fisher Scientific
MagJET NGS Cleanup and Size Selection Kit by Thermo Fisher Scientific	MagJET NGS Cleanup and Size Selection Kit by Thermo Fisher Scientific sourced from https://www.biocompare.com, accessed May 2020.	FG	https://fair-genomes.org/KIT92	MagJET NGS Cleanup and Size Selection Kit by Thermo Fisher Scientific
MagJET NGS Cleanup and Size Selection Kit (1 x 96 preps) by Thermo Fisher Scientific	MagJET NGS Cleanup and Size Selection Kit (1 x 96 preps) by Thermo Fisher Scientific sourced from https://www.biocompare.com, accessed May 2020.	FG	https://fair-genomes.org/KIT93	MagJET NGS Cleanup and Size Selection Kit (1 x 96 preps) by Thermo Fisher Scientific
MagJET NGS Cleanup and Size Selection Kit (10 x 96 preps) by Thermo Fisher Scientific	MagJET NGS Cleanup and Size Selection Kit (10 x 96 preps) by Thermo Fisher Scientific sourced from https://www.biocompare.com, accessed May 2020.	FG	https://fair-genomes.org/KIT94	MagJET NGS Cleanup and Size Selection Kit (10 x 96 preps) by Thermo Fisher Scientific
MagJET NGS Cleanup and Size Selection Kit (4 x 96 preps) by Thermo Fisher Scientific	MagJET NGS Cleanup and Size Selection Kit (4 x 96 preps) by Thermo Fisher Scientific sourced from https://www.biocompare.com, accessed May 2020.	FG	https://fair-genomes.org/KIT95	MagJET NGS Cleanup and Size Selection Kit (4 x 96 preps) by Thermo Fisher Scientific
MuSeek Barcode Set 1, Ion Torrent compatible by Thermo Fisher Scientific	MuSeek Barcode Set 1, Ion Torrent compatible by Thermo Fisher Scientific sourced from https://www.biocompare.com, accessed May 2020.	FG	https://fair-genomes.org/KIT96	MuSeek Barcode Set 1, Ion Torrent compatible by Thermo Fisher Scientific
MuSeek Index Set 1, Illumina compatible by Thermo Fisher Scientific	MuSeek Index Set 1, Illumina compatible by Thermo Fisher Scientific sourced from https://www.biocompare.com, accessed May 2020.	FG	https://fair-genomes.org/KIT97	MuSeek Index Set 1, Illumina compatible by Thermo Fisher Scientific
